B1: Alpha | I1: Alpha
A2: n | B2: 0.20 | C2: 0.10 | D2: 0.05 | E2: 0.02 | F2: 0.01 | H2: n | I2: 0.20 | J2: 0.10 | K2: 0.05 | L2: 0.02 | M2: 0.01
A3: 1 | B3: 0.900 | C3: 0.950 | D3: 0.97499999999999998 | E3: 0.990 | F3: 0.995 | H3: 21 | I3: 0.22600000000000001 | J3: 0.25900000000000001 | K3: 0.28699999999999998 | L3: 0.32100000000000001 | M3: 0.34399999999999997
A4: =A3+1 -> 2 | B4: 0.68400000000000005 | C4: 0.77600000000000002 | D4: 0.84199999999999997 | E4: 0.900 | F4: 0.92900000000000005 | H4: =H3+1 -> 22 | I4: 0.221 | J4: 0.253 | K4: 0.28100000000000003 | L4: 0.314 | M4: 0.33700000000000002
A5: =A4+1 -> 3 | B5: 0.56499999999999995 | C5: 0.63600000000000001 | D5: 0.70799999999999996 | E5: 0.78500000000000003 | F5: 0.82899999999999996 | H5: =H4+1 -> 23 | I5: 0.216 | J5: 0.247 | K5: 0.27500000000000002 | L5: 0.307 | M5: 0.330
A6: =A5+1 -> 4 | B6: 0.49299999999999999 | C6: 0.65600000000000003 | D6: 0.624 | E6: 0.68899999999999995 | F6: 0.73399999999999999 | H6: =H5+1 -> 24 | I6: 0.21199999999999999 | J6: 0.24199999999999999 | K6: 0.26900000000000002 | L6: 0.30099999999999999 | M6: 0.32300000000000001
A7: =A6+1 -> 5 | B7: 0.44700000000000001 | C7: 0.50900000000000001 | D7: 0.56299999999999994 | E7: 0.627 | F7: 0.66900000000000004 | H7: =H6+1 -> 25 | I7: 0.20799999999999999 | J7: 0.23799999999999999 | K7: 0.26400000000000001 | L7: 0.29499999999999998 | M7: 0.317
A8: =A7+1 -> 6 | B8: 0.410 | C8: 0.46800000000000003 | D8: 0.51900000000000002 | E8: 0.57699999999999996 | F8: 0.61699999999999999 | H8: =H7+1 -> 26 | I8: 0.20399999999999999 | J8: 0.23300000000000001 | K8: 0.25900000000000001 | L8: 0.290 | M8: 0.311
A9: =A8+1 -> 7 | B9: 0.38100000000000001 | C9: 0.436 | D9: 0.48299999999999998 | E9: 0.53800000000000003 | F9: 0.57599999999999996 | H9: =H8+1 -> 27 | I9: 0.200 | J9: 0.22900000000000001 | K9: 0.254 | L9: 0.28399999999999997 | M9: 0.30499999999999999
A10: =A9+1 -> 8 | B10: 0.35799999999999998 | C10: 0.410 | D10: 0.45400000000000001 | E10: 0.50700000000000001 | F10: 0.54200000000000004 | H10: =H9+1 -> 28 | I10: 0.19700000000000001 | J10: 0.22500000000000001 | K10: 0.250 | L10: 0.27900000000000003 | M10: 0.300
A11: =A10+1 -> 9 | B11: 0.33900000000000002 | C11: 0.38700000000000001 | D11: 0.430 | E11: 0.480 | F11: 0.51300000000000001 | H11: =H10+1 -> 29 | I11: 0.193 | J11: 0.221 | K11: 0.246 | L11: 0.27500000000000002 | M11: 0.29499999999999998
A12: =A11+1 -> 10 | B12: 0.32300000000000001 | C12: 0.36899999999999999 | D12: 0.40899999999999997 | E12: 0.45700000000000002 | F12: 0.48899999999999999 | H12: =H11+1 -> 30 | I12: 0.190 | J12: 0.218 | K12: 0.24199999999999999 | L12: 0.270 | M12: 0.290
A13: =A12+1 -> 11 | B13: 0.308 | C13: 0.35199999999999998 | D13: 0.39100000000000001 | E13: 0.437 | F13: 0.46800000000000003 | H13: =H12+1 -> 31 | I13: 0.187 | J13: 0.214 | K13: 0.23799999999999999 | L13: 0.26600000000000001 | M13: 0.28499999999999998
A14: =A13+1 -> 12 | B14: 0.29599999999999999 | C14: 0.33800000000000002 | D14: 0.375 | E14: 0.41899999999999998 | F14: 0.44900000000000001 | H14: =H13+1 -> 32 | I14: 0.184 | J14: 0.21099999999999999 | K14: 0.23400000000000001 | L14: 0.26200000000000001 | M14: 0.28100000000000003
A15: =A14+1 -> 13 | B15: 0.28499999999999998 | C15: 0.32500000000000001 | D15: 0.36099999999999999 | E15: 0.40400000000000003 | F15: 0.432 | H15: =H14+1 -> 33 | I15: 0.182 | J15: 0.20799999999999999 | K15: 0.23100000000000001 | L15: 0.25800000000000001 | M15: 0.27700000000000002
A16: =A15+1 -> 14 | B16: 0.27500000000000002 | C16: 0.314 | D16: 0.34899999999999998 | E16: 0.390 | F16: 0.41799999999999998 | H16: =H15+1 -> 34 | I16: 0.17899999999999999 | J16: 0.20499999999999999 | K16: 0.22700000000000001 | L16: 0.254 | M16: 0.27300000000000002
A17: =A16+1 -> 15 | B17: 0.26600000000000001 | C17: 0.30399999999999999 | D17: 0.33800000000000002 | E17: 0.377 | F17: 0.40400000000000003 | H17: =H16+1 -> 35 | I17: 0.17699999999999999 | J17: 0.20200000000000001 | K17: 0.224 | L17: 0.251 | M17: 0.26900000000000002
A18: =A17+1 -> 16 | B18: 0.25800000000000001 | C18: 0.29499999999999998 | D18: 0.32700000000000001 | E18: 0.36599999999999999 | F18: 0.39200000000000002 | H18: =H17+1 -> 36 | I18: 0.17399999999999999 | J18: 0.19900000000000001 | K18: 0.221 | L18: 0.247 | M18: 0.26500000000000001
A19: =A18+1 -> 17 | B19: 0.250 | C19: 0.28599999999999998 | D19: 0.318 | E19: 0.35499999999999998 | F19: 0.38100000000000001 | H19: =H18+1 -> 37 | I19: 0.17199999999999999 | J19: 0.19600000000000001 | K19: 0.218 | L19: 0.24399999999999999 | M19: 0.26200000000000001
A20: =A19+1 -> 18 | B20: 0.24399999999999999 | C20: 0.27900000000000003 | D20: 0.309 | E20: 0.34599999999999997 | F20: 0.371 | H20: =H19+1 -> 38 | I20: 0.170 | J20: 0.19400000000000001 | K20: 0.215 | L20: 0.24099999999999999 | M20: 0.25800000000000001
A21: =A20+1 -> 19 | B21: 0.23699999999999999 | C21: 0.27100000000000002 | D21: 0.30099999999999999 | E21: 0.33700000000000002 | F21: 0.36099999999999999 | H21: =H20+1 -> 39 | I21: 0.16800000000000001 | J21: 0.191 | K21: 0.21299999999999999 | L21: 0.23799999999999999 | M21: 0.255
A22: =A21+1 -> 20 | B22: 0.23200000000000001 | C22: 0.26500000000000001 | D22: 0.29399999999999998 | E22: 0.32900000000000001 | F22: 0.35199999999999998 | H22: =H21+1 -> 40 | I22: 0.16500000000000001 | J22: 0.189 | K22: 0.210 | L22: 0.23499999999999999 | M22: 0.252

A1: Approximation for n > 40